{
  "publisher": "brf-tech",
  "summary": {
    "en": "The whole filex interface in Spanish: the explorer, the admin panel, the settings and the public share pages. AI-translated, awaiting review by a native speaker - corrections welcome."
  },
  "description": "description.md",
  "icon": "icon.png"
}
